<?xml version="1.0" encoding="UTF-8"?>
<!--
	Copyright 2005-2008 The Kuali Foundation
	
	Licensed under the Educational Community License, Version 2.0 (the "License");
	you may not use this file except in compliance with the License.
	You may obtain a copy of the License at
	
	http://www.opensource.org/licenses/ecl2.php
	
	Unless required by applicable law or agreed to in writing, software
	distributed under the License is distributed on an "AS IS" BASIS,
	WITHOUT WARRANTIES OR CONDITIONS OF ANY KIND, either express or implied.
	See the License for the specific language governing permissions and
	limitations under the License.
-->
<transactions xmlns="http://www.kuali.org/kfs/fp/procurementCard"
	xmlns:xsi="http://www.w3.org/2001/XMLSchema-instance"
	xsi:schemaLocation="http://www.kuali.org/kfs/fp/procurementCard @externalizable.static.content.url@/xsd/fp/procurementCard.xsd" >

	<transaction>
		<transactionCreditCardNumber>99991111200</transactionCreditCardNumber>
		<financialDocumentTotalAmount>11.55</financialDocumentTotalAmount>
		<transactionDebitCreditCode>D</transactionDebitCreditCode>
		<chartOfAccountsCode>AA</chartOfAccountsCode>
		<accountNumber>9999999</accountNumber>
		<financialObjectCode>9999</financialObjectCode>
		<transactionCycleStartDate>2006-02-20</transactionCycleStartDate>
		<transactionCycleEndDate>2006-02-20</transactionCycleEndDate>
		<cardHolderName>Molecular Structure Center</cardHolderName>
		<transactionDate>2006-02-17</transactionDate>
		<transactionReferenceNumber>554173460487304813890</transactionReferenceNumber>
		<transactionMerchantCategoryCode>7622</transactionMerchantCategoryCode>
		<transactionPostingDate>2006-02-17</transactionPostingDate>
		<vendorName>STANSIFER RADIO CO</vendorName>
	</transaction>
</transactions>
